,ind,title,text,label,tok_nums
38,38,annakarenina,"�Why didn�t I die?� and the words and the feeling of that time came back to her. And all at once she knew what was in her soul. Yes, it was that idea which alone solved all. �Yes, to die!... And the shame and disgrace of Alexey Alexandrovitch and of Seryozha, and my awful shame, it will all be saved by death. ",guilt_penance_self_loathing,"[101, 2339, 2134, 2102, 1045, 3280, 1029, 1998, 1996, 2616, 1998, 1996, 3110, 1997, 2008, 2051, 2234, 2067, 2000, 2014, 1012, 1998, 2035, 2012, 2320, 2016, 2354, 2054, 2001, 1999, 2014, 3969, 1012, 2748, 1010, 2009, 2001, 2008, 2801, 2029, 2894, 13332, 2035, 1012, 2748, 1010, 2000, 3280, 999, 1012, 1012, 1012, 1998, 1996, 9467, 1998, 29591, 1997, 4074, 3240, 24969, 4859, 12298, 20189, 1998, 1997, 14262, 7677, 27922, 2050, 1010, 1998, 2026, 9643, 9467, 1010, 2009, 2097, 2035, 2022, 5552, 2011, 2331, 1012, 102]"
39,39,annakarenina,"To die! and he will feel remorse; will be sorry; will love me; he will suffer on my account.� With the trace of a smile of commiseration for herself she sat down in the armchair, taking off and putting on the rings on her left hand, vividly picturing from different sides his feelings after her death.",romantic_reunion,"[101, 2000, 3280, 999, 1998, 2002, 2097, 2514, 23124, 1025, 2097, 2022, 3374, 1025, 2097, 2293, 2033, 1025, 2002, 2097, 9015, 2006, 2026, 4070, 1012, 2007, 1996, 7637, 1997, 1037, 2868, 1997, 4012, 28732, 8156, 2005, 2841, 2016, 2938, 2091, 1999, 1996, 29372, 1010, 2635, 2125, 1998, 5128, 2006, 1996, 7635, 2006, 2014, 2187, 2192, 1010, 14954, 2135, 27263, 16037, 2013, 2367, 3903, 2010, 5346, 2044, 2014, 2331, 1012, 102]"
40,40,annakarenina,"And death rose clearly and vividly before her mind as the sole means of bringing back love for her in his heart, of punishing him and of gaining the victory in that strife which the evil spirit in possession of her heart was waging with him. ",romantic_reunion,"[101, 1998, 2331, 3123, 4415, 1998, 14954, 2135, 2077, 2014, 2568, 2004, 1996, 7082, 2965, 1997, 5026, 2067, 2293, 2005, 2014, 1999, 2010, 2540, 1010, 1997, 16385, 2075, 2032, 1998, 1997, 8550, 1996, 3377, 1999, 2008, 27865, 2029, 1996, 4763, 4382, 1999, 6664, 1997, 2014, 2540, 2001, 11333, 4726, 2007, 2032, 1012, 102]"
41,41,annakarenina,"Now nothing mattered: going or not going to Vozdvizhenskoe, getting or not getting a divorce from her husband�all that did not matter. The one thing that mattered was punishing him. When she poured herself out her usual dose of opium, and thought that she had only to drink off the whole bottle to die, it seemed to her so simple and easy, that she began musing with enjoyment on how he would suffer, and repent and love her memory when it would be too late. ",romantic_reunion,"[101, 2085, 2498, 13836, 1024, 2183, 2030, 2025, 2183, 2000, 29536, 26494, 5737, 27922, 6132, 3683, 2063, 1010, 2893, 2030, 2025, 2893, 1037, 8179, 2013, 2014, 3129, 8095, 2008, 2106, 2025, 3043, 1012, 1996, 2028, 2518, 2008, 13836, 2001, 16385, 2075, 2032, 1012, 2043, 2016, 8542, 2841, 2041, 2014, 5156, 13004, 1997, 21075, 1010, 1998, 2245, 2008, 2016, 2018, 2069, 2000, 4392, 2125, 1996, 2878, 5835, 2000, 3280, 1010, 2009, 2790, 2000, 2014, 2061, 3722, 1998, 3733, 1010, 2008, 2016, 2211, 14163, 7741, 2007, 20195, 2006, 2129, 2002, 2052, 9015, 1010, 1998, 16360, 4765, 1998, 2293, 2014, 3638, 2043, 2009, 2052, 2022, 2205, 2397, 1012, 102]"
42,42,annakarenina,"She lay in bed with open eyes, by the light of a single burned-down candle, gazing at the carved cornice of the ceiling and at the shadow of the screen that covered part of it, while she vividly pictured to herself how he would feel when she would be no more, when she would be only a memory to him. �How could I say such cruel things to her?� he would say. �How could I go out of the room without saying anything to her? But now she is no more. She has gone away from us forever. She is....�",romantic_reunion,"[101, 2016, 3913, 1999, 2793, 2007, 2330, 2159, 1010, 2011, 1996, 2422, 1997, 1037, 2309, 5296, 1011, 2091, 13541, 1010, 16448, 2012, 1996, 7844, 27848, 1997, 1996, 5894, 1998, 2012, 1996, 5192, 1997, 1996, 3898, 2008, 3139, 2112, 1997, 2009, 1010, 2096, 2016, 14954, 2135, 15885, 2000, 2841, 2129, 2002, 2052, 2514, 2043, 2016, 2052, 2022, 2053, 2062, 1010, 2043, 2016, 2052, 2022, 2069, 1037, 3638, 2000, 2032, 1012, 2129, 2071, 1045, 2360, 2107, 10311, 2477, 2000, 2014, 1029, 2002, 2052, 2360, 1012, 2129, 2071, 1045, 2175, 2041, 1997, 1996, 2282, 2302, 3038, 2505, 2000, 2014, 1029, 2021, 2085, 2016, 2003, 2053, 2062, 1012, 2016, 2038, 2908, 2185, 2013, 2149, 5091, 1012, 2016, 2003, 1012, 1012, 1012, 1012, 102]"
43,43,annakarenina,"""For six weeks he did not speak to anyone, and would not touch food except when I implored him. And not for one minute could we leave him alone. We took away everything he could have used against himself. We lived on the ground floor, but there was no reckoning on anything. You know, of course, that he had shot himself once already on her account,� she said, and the old lady�s eyelashes twitched at the recollection. �Yes, hers was the fitting end for such a woman. Even the death she chose was low and vulgar.�",romantic_reunion,"[101, 1000, 2005, 2416, 3134, 2002, 2106, 2025, 3713, 2000, 3087, 1010, 1998, 2052, 2025, 3543, 2833, 3272, 2043, 1045, 17727, 20186, 2094, 2032, 1012, 1998, 2025, 2005, 2028, 3371, 2071, 2057, 2681, 2032, 2894, 1012, 2057, 2165, 2185, 2673, 2002, 2071, 2031, 2109, 2114, 2370, 1012, 2057, 2973, 2006, 1996, 2598, 2723, 1010, 2021, 2045, 2001, 2053, 29072, 2075, 2006, 2505, 1012, 2017, 2113, 1010, 1997, 2607, 1010, 2008, 2002, 2018, 2915, 2370, 2320, 2525, 2006, 2014, 4070, 1010, 2016, 2056, 1010, 1998, 1996, 2214, 3203, 2015, 25150, 16767, 2012, 1996, 28667, 14511, 18491, 1012, 2748, 1010, 5106, 2001, 1996, 11414, 2203, 2005, 2107, 1037, 2450, 1012, 2130, 1996, 2331, 2016, 4900, 2001, 2659, 1998, 29364, 1012, 102]"
44,44,annakarenina,"She had set him free. But my poor son was utterly given up to her. He had thrown up everything, his career, me, and even then she had no mercy on him, but of set purpose she made his ruin complete. No, say what you will, her very death was the death of a vile woman, of no religious feeling. God forgive me, but I can�t help hating the memory of her, when I look at my son�s misery!�",cowardice_foolish_unpleasant,"[101, 2016, 2018, 2275, 2032, 2489, 1012, 2021, 2026, 3532, 2365, 2001, 12580, 2445, 2039, 2000, 2014, 1012, 2002, 2018, 6908, 2039, 2673, 1010, 2010, 2476, 1010, 2033, 1010, 1998, 2130, 2059, 2016, 2018, 2053, 8673, 2006, 2032, 1010, 2021, 1997, 2275, 3800, 2016, 2081, 2010, 10083, 3143, 1012, 2053, 1010, 2360, 2054, 2017, 2097, 1010, 2014, 2200, 2331, 2001, 1996, 2331, 1997, 1037, 25047, 2450, 1010, 1997, 2053, 3412, 3110, 1012, 2643, 9641, 2033, 1010, 2021, 1045, 2064, 2102, 2393, 22650, 1996, 3638, 1997, 2014, 1010, 2043, 1045, 2298, 2012, 2026, 4124, 14624, 999, 102]"
45,45,annakarenina,"�Without knowing what I am and why I am here, life�s impossible; and that I can�t know, and so I can�t live,� Levin said to himself",hopeless_empty_agony,"[101, 2302, 4209, 2054, 1045, 2572, 1998, 2339, 1045, 2572, 2182, 1010, 2166, 2015, 5263, 1025, 1998, 2008, 1045, 2064, 2102, 2113, 1010, 1998, 2061, 1045, 2064, 2102, 2444, 1010, 20206, 2056, 2000, 2370, 102]"
46,46,annakarenina,"He must escape from this power. And the means of escape every man had in his own hands. He had but to cut short this dependence on evil. And there was one means�death. And Levin, a happy father and husband, in perfect health, was several times so near suicide that he hid the cord that he might not be tempted to hang himself, and was afraid to go out with his gun for fear of shooting himself. But Levin did not shoot himself, and did not hang himself; he went on living.",guilt_penance_self_loathing,"[101, 2002, 2442, 4019, 2013, 2023, 2373, 1012, 1998, 1996, 2965, 1997, 4019, 2296, 2158, 2018, 1999, 2010, 2219, 2398, 1012, 2002, 2018, 2021, 2000, 3013, 2460, 2023, 18642, 2006, 4763, 1012, 1998, 2045, 2001, 2028, 2965, 3207, 8988, 1012, 1998, 20206, 1010, 1037, 3407, 2269, 1998, 3129, 1010, 1999, 3819, 2740, 1010, 2001, 2195, 2335, 2061, 2379, 5920, 2008, 2002, 11041, 1996, 11601, 2008, 2002, 2453, 2025, 2022, 16312, 2000, 6865, 2370, 1010, 1998, 2001, 4452, 2000, 2175, 2041, 2007, 2010, 3282, 2005, 3571, 1997, 5008, 2370, 1012, 2021, 20206, 2106, 2025, 5607, 2370, 1010, 1998, 2106, 2025, 6865, 2370, 1025, 2002, 2253, 2006, 2542, 1012, 102]"
47,47,annakarenina,"Then, for the first time, grasping that for every man, and himself too, there was nothing in store but suffering, death, and forgetfulness, he had made up his mind that life was impossible like that, and that he must either interpret life so that it would not present itself to him as the evil jest of some devil, or shoot himself. But he had not done either, but had gone on living, thinking, and feeling, and had even at that very time married, and had had many joys and had been happy, when he was not thinking of the meaning of his life.",hopeless_empty_agony,"[101, 2059, 1010, 2005, 1996, 2034, 2051, 1010, 20854, 2008, 2005, 2296, 2158, 1010, 1998, 2370, 2205, 1010, 2045, 2001, 2498, 1999, 3573, 2021, 6114, 1010, 2331, 1010, 1998, 5293, 20938, 1010, 2002, 2018, 2081, 2039, 2010, 2568, 2008, 2166, 2001, 5263, 2066, 2008, 1010, 1998, 2008, 2002, 2442, 2593, 17841, 2166, 2061, 2008, 2009, 2052, 2025, 2556, 2993, 2000, 2032, 2004, 1996, 4763, 15333, 3367, 1997, 2070, 6548, 1010, 2030, 5607, 2370, 1012, 2021, 2002, 2018, 2025, 2589, 2593, 1010, 2021, 2018, 2908, 2006, 2542, 1010, 3241, 1010, 1998, 3110, 1010, 1998, 2018, 2130, 2012, 2008, 2200, 2051, 2496, 1010, 1998, 2018, 2018, 2116, 6569, 2015, 1998, 2018, 2042, 3407, 1010, 2043, 2002, 2001, 2025, 3241, 1997, 1996, 3574, 1997, 2010, 2166, 1012, 102]"
48,48,annakarenina,"He had lived (without being aware of it) on those spiritual truths that he had sucked in with his mother�s milk, but he had thought, not merely without recognition of these truths, but studiously ignoring them. Now it was clear to him that he could only live by virtue of the beliefs in which he had been brought up. �What should I have been, and how should I have spent my life, if I had not had these beliefs, if I had not known that I must live for God and not for my own desires?""",senseless_meaning_making,"[101, 2002, 2018, 2973, 1006, 2302, 2108, 5204, 1997, 2009, 1007, 2006, 2216, 6259, 23019, 2008, 2002, 2018, 8631, 1999, 2007, 2010, 10756, 6501, 1010, 2021, 2002, 2018, 2245, 1010, 2025, 6414, 2302, 5038, 1997, 2122, 23019, 1010, 2021, 2996, 27191, 9217, 2068, 1012, 2085, 2009, 2001, 3154, 2000, 2032, 2008, 2002, 2071, 2069, 2444, 2011, 11870, 1997, 1996, 9029, 1999, 2029, 2002, 2018, 2042, 2716, 2039, 1012, 2054, 2323, 1045, 2031, 2042, 1010, 1998, 2129, 2323, 1045, 2031, 2985, 2026, 2166, 1010, 2065, 1045, 2018, 2025, 2018, 2122, 9029, 1010, 2065, 1045, 2018, 2025, 2124, 2008, 1045, 2442, 2444, 2005, 2643, 1998, 2025, 2005, 2026, 2219, 14714, 1029, 1000, 102]"
49,49,annakarenina,"And all at once she thought of the man crushed by the train the day she had first met Vronsky, and she knew what she had to do. With a rapid, light step she went down the steps that led from the tank to the rails and stopped quite near the approaching train. She looked at the lower part of the carriages, at the screws and chains and the tall cast-iron wheel of the first carriage slowly moving up, and trying to measure the middle between the front and back wheels, and the very minute when that middle point would be opposite her. �There,� she said to herself, looking into the shadow of the carriage, at the sand and coal dust which covered the sleepers��there, in the very middle, and I will punish him and escape from everyone and from myself.� ",romantic_reunion,"[101, 1998, 2035, 2012, 2320, 2016, 2245, 1997, 1996, 2158, 10560, 2011, 1996, 3345, 1996, 2154, 2016, 2018, 2034, 2777, 27830, 5644, 4801, 1010, 1998, 2016, 2354, 2054, 2016, 2018, 2000, 2079, 1012, 2007, 1037, 5915, 1010, 2422, 3357, 2016, 2253, 2091, 1996, 4084, 2008, 2419, 2013, 1996, 4951, 2000, 1996, 15168, 1998, 3030, 3243, 2379, 1996, 8455, 3345, 1012, 2016, 2246, 2012, 1996, 2896, 2112, 1997, 1996, 17744, 1010, 2012, 1996, 11224, 2015, 1998, 8859, 1998, 1996, 4206, 3459, 1011, 3707, 5217, 1997, 1996, 2034, 9118, 3254, 3048, 2039, 1010, 1998, 2667, 2000, 5468, 1996, 2690, 2090, 1996, 2392, 1998, 2067, 7787, 1010, 1998, 1996, 2200, 3371, 2043, 2008, 2690, 2391, 2052, 2022, 4500, 2014, 1012, 2045, 1010, 2016, 2056, 2000, 2841, 1010, 2559, 2046, 1996, 5192, 1997, 1996, 9118, 1010, 2012, 1996, 5472, 1998, 5317, 6497, 2029, 3139, 1996, 24372, 3367, 5886, 2063, 1010, 1999, 1996, 2200, 2690, 1010, 1998, 1045, 2097, 16385, 2032, 1998, 4019, 2013, 3071, 1998, 2013, 2870, 1012, 102]"
50,50,annakarenina,"�Lord, forgive me all!� she said, feeling it impossible to struggle. ",guilt_penance_self_loathing,"[101, 2935, 1010, 9641, 2033, 2035, 999, 2016, 2056, 1010, 3110, 2009, 5263, 2000, 5998, 1012, 102]"
51,51,annakarenina,"A peasant muttering something was working at the iron above her. And the light by which she had read the book filled with troubles, falsehoods, sorrow, and evil, flared up more brightly than ever before, lighted up for her all that had been in darkness, flickered, began to grow dim, and was quenched forever.",hopeless_empty_agony,"[101, 1037, 14539, 22581, 2242, 2001, 2551, 2012, 1996, 3707, 2682, 2014, 1012, 1998, 1996, 2422, 2011, 2029, 2016, 2018, 3191, 1996, 2338, 3561, 2007, 13460, 1010, 6270, 9021, 2015, 1010, 14038, 1010, 1998, 4763, 1010, 14937, 2039, 2062, 14224, 2084, 2412, 2077, 1010, 26390, 2039, 2005, 2014, 2035, 2008, 2018, 2042, 1999, 4768, 1010, 15999, 1010, 2211, 2000, 4982, 11737, 1010, 1998, 2001, 10861, 19282, 5091, 1012, 102]"
52,52,annakarenina,"He still lay down, trying to sleep, though he felt there was not the smallest hope of it, and kept repeating stray words from some chain of thought, trying by this to check the rising flood of fresh images. He listened, and heard in a strange, mad whisper words repeated: �I did not appreciate it, did not make enough of it. I did not appreciate it, did not make enough of it.� �What�s this? Am I going out of my mind?� he said to himself. �Perhaps. What makes men go out of their minds; what makes men shoot themselves?�",hopeless_empty_agony,"[101, 2002, 2145, 3913, 2091, 1010, 2667, 2000, 3637, 1010, 2295, 2002, 2371, 2045, 2001, 2025, 1996, 10479, 3246, 1997, 2009, 1010, 1998, 2921, 15192, 15926, 2616, 2013, 2070, 4677, 1997, 2245, 1010, 2667, 2011, 2023, 2000, 4638, 1996, 4803, 7186, 1997, 4840, 4871, 1012, 2002, 7791, 1010, 1998, 2657, 1999, 1037, 4326, 1010, 5506, 7204, 2616, 5567, 1024, 1045, 2106, 2025, 9120, 2009, 1010, 2106, 2025, 2191, 2438, 1997, 2009, 1012, 1045, 2106, 2025, 9120, 2009, 1010, 2106, 2025, 2191, 2438, 1997, 2009, 1012, 2054, 2015, 2023, 1029, 2572, 1045, 2183, 2041, 1997, 2026, 2568, 1029, 2002, 2056, 2000, 2370, 1012, 3383, 1012, 2054, 3084, 2273, 2175, 2041, 1997, 2037, 9273, 1025, 2054, 3084, 2273, 5607, 3209, 1029, 102]"
53,53,annakarenina,"�I must think what to do. What is left?� His mind rapidly ran through his life apart from his love of Anna. �Ambition? Serpuhovskoy? Society? The court?� He could not come to a pause anywhere. All of it had had meaning before, but now there was no reality in it. He got up from the sofa, took off his coat, undid his belt, and uncovering his hairy chest to breathe more freely, walked up and down the room. �This is how people go mad,� he repeated, �and how they shoot themselves ... to escape humiliation,� he added slowly. 
",romantic_reunion,"[101, 1045, 2442, 2228, 2054, 2000, 2079, 1012, 2054, 2003, 2187, 1029, 2010, 2568, 5901, 2743, 2083, 2010, 2166, 4237, 2013, 2010, 2293, 1997, 4698, 1012, 16290, 1029, 14262, 14289, 6806, 15088, 3683, 2100, 1029, 2554, 1029, 1996, 2457, 1029, 2002, 2071, 2025, 2272, 2000, 1037, 8724, 5973, 1012, 2035, 1997, 2009, 2018, 2018, 3574, 2077, 1010, 2021, 2085, 2045, 2001, 2053, 4507, 1999, 2009, 1012, 2002, 2288, 2039, 2013, 1996, 10682, 1010, 2165, 2125, 2010, 5435, 1010, 6151, 3593, 2010, 5583, 1010, 1998, 26944, 2075, 2010, 15892, 3108, 2000, 7200, 2062, 10350, 1010, 2939, 2039, 1998, 2091, 1996, 2282, 1012, 2023, 2003, 2129, 2111, 2175, 5506, 1010, 2002, 5567, 1010, 1998, 2129, 2027, 5607, 3209, 1012, 1012, 1012, 2000, 4019, 21171, 1010, 2002, 2794, 3254, 1012, 102]"
54,54,annakarenina,"He went to the door and closed it, then with fixed eyes and clenched teeth he went up to the table, took a revolver, looked round him, turned it to a loaded barrel, and sank into thought. For two minutes, his head bent forward with an expression of an intense effort of thought, he stood with the revolver in his hand, motionless, thinking. �Of course,� he said to himself, as though a logical, continuous, and clear chain of reasoning had brought him to an indubitable conclusion. In reality this �of course,� that seemed convincing to him, was simply the result of exactly the same circle of memories and images through which he had passed ten times already during the last hour�memories of happiness lost forever.",hopeless_empty_agony,"[101, 2002, 2253, 2000, 1996, 2341, 1998, 2701, 2009, 1010, 2059, 2007, 4964, 2159, 1998, 8555, 4091, 2002, 2253, 2039, 2000, 1996, 2795, 1010, 2165, 1037, 17863, 1010, 2246, 2461, 2032, 1010, 2357, 2009, 2000, 1037, 8209, 8460, 1010, 1998, 7569, 2046, 2245, 1012, 2005, 2048, 2781, 1010, 2010, 2132, 6260, 2830, 2007, 2019, 3670, 1997, 2019, 6387, 3947, 1997, 2245, 1010, 2002, 2768, 2007, 1996, 17863, 1999, 2010, 2192, 1010, 19917, 1010, 3241, 1012, 1997, 2607, 1010, 2002, 2056, 2000, 2370, 1010, 2004, 2295, 1037, 11177, 1010, 7142, 1010, 1998, 3154, 4677, 1997, 13384, 2018, 2716, 2032, 2000, 2019, 27427, 12083, 6590, 3468, 7091, 1012, 1999, 4507, 2023, 1997, 2607, 1010, 2008, 2790, 13359, 2000, 2032, 1010, 2001, 3432, 1996, 2765, 1997, 3599, 1996, 2168, 4418, 1997, 5758, 1998, 4871, 2083, 2029, 2002, 2018, 2979, 2702, 2335, 2525, 2076, 1996, 2197, 3178, 4168, 24610, 2229, 1997, 8404, 2439, 5091, 1012, 102]"
55,55,annakarenina," There was the same conception of the senselessness of everything to come in life, the same consciousness of humiliation. Even the sequence of these images and emotions was the same. �Of course,� he repeated, when for the third time his thought passed again round the same spellbound circle of memories and images, and pulling the revolver to the left side of his chest, and clutching it vigorously with his whole hand, as it were, squeezing it in his fist, he pulled the trigger. ",senseless_meaning_making,"[101, 2045, 2001, 1996, 2168, 13120, 1997, 1996, 3168, 24913, 1997, 2673, 2000, 2272, 1999, 2166, 1010, 1996, 2168, 8298, 1997, 21171, 1012, 2130, 1996, 5537, 1997, 2122, 4871, 1998, 6699, 2001, 1996, 2168, 1012, 1997, 2607, 1010, 2002, 5567, 1010, 2043, 2005, 1996, 2353, 2051, 2010, 2245, 2979, 2153, 2461, 1996, 2168, 6297, 15494, 4418, 1997, 5758, 1998, 4871, 1010, 1998, 4815, 1996, 17863, 2000, 1996, 2187, 2217, 1997, 2010, 3108, 1010, 1998, 14197, 2009, 22400, 2007, 2010, 2878, 2192, 1010, 2004, 2009, 2020, 1010, 15328, 2009, 1999, 2010, 7345, 1010, 2002, 2766, 1996, 9495, 1012, 102]"
56,56,annakarenina,"He did not hear the sound of the shot, but a violent blow on his chest sent him reeling. He tried to clutch at the edge of the table, dropped the revolver, staggered, and sat down on the ground, looking about him in astonishment. He did not recognize his room, looking up from the ground, at the bent legs of the table, at the wastepaper basket, and the tiger-skin rug. The hurried, creaking steps of his servant coming through the drawing-room brought him to his senses. He made an effort at thought, and was aware that he was on the floor; and seeing blood on the tiger-skin rug and on his arm, he knew he had shot himself. �Idiotic! Missed!� he said, fumbling after the revolver. ",cowardice_foolish_unpleasant,"[101, 2002, 2106, 2025, 2963, 1996, 2614, 1997, 1996, 2915, 1010, 2021, 1037, 6355, 6271, 2006, 2010, 3108, 2741, 2032, 28515, 1012, 2002, 2699, 2000, 15357, 2012, 1996, 3341, 1997, 1996, 2795, 1010, 3333, 1996, 17863, 1010, 14648, 1010, 1998, 2938, 2091, 2006, 1996, 2598, 1010, 2559, 2055, 2032, 1999, 23819, 1012, 2002, 2106, 2025, 6807, 2010, 2282, 1010, 2559, 2039, 2013, 1996, 2598, 1010, 2012, 1996, 6260, 3456, 1997, 1996, 2795, 1010, 2012, 1996, 5949, 23298, 10810, 1010, 1998, 1996, 6816, 1011, 3096, 20452, 1012, 1996, 9520, 1010, 13675, 25508, 2075, 4084, 1997, 2010, 7947, 2746, 2083, 1996, 5059, 1011, 2282, 2716, 2032, 2000, 2010, 9456, 1012, 2002, 2081, 2019, 3947, 2012, 2245, 1010, 1998, 2001, 5204, 2008, 2002, 2001, 2006, 1996, 2723, 1025, 1998, 3773, 2668, 2006, 1996, 6816, 1011, 3096, 20452, 1998, 2006, 2010, 2849, 1010, 2002, 2354, 2002, 2018, 2915, 2370, 1012, 10041, 2594, 999, 4771, 999, 2002, 2056, 1010, 11865, 29256, 2044, 1996, 17863, 1012, 102]"
57,57,anthonyandcleopatra,"It were pity to cast them away for nothing, though, between them and a great cause they should be esteemed nothing. Cleopatra, catching but the least noise of this, dies instantly. I have seen her die twenty times upon far poorer moment. I do think there is mettle in death which commits some loving act upon her, she hath such a celerity in dying.",cowardice_foolish_unpleasant,"[101, 2009, 2020, 12063, 2000, 3459, 2068, 2185, 2005, 2498, 1010, 2295, 1010, 2090, 2068, 1998, 1037, 2307, 3426, 2027, 2323, 2022, 19593, 2098, 2498, 1012, 22003, 1010, 9105, 2021, 1996, 2560, 5005, 1997, 2023, 1010, 8289, 6880, 1012, 1045, 2031, 2464, 2014, 3280, 3174, 2335, 2588, 2521, 27196, 2617, 1012, 1045, 2079, 2228, 2045, 2003, 2777, 9286, 1999, 2331, 2029, 27791, 2070, 8295, 2552, 2588, 2014, 1010, 2016, 6045, 2232, 2107, 1037, 8292, 3917, 3012, 1999, 5996, 1012, 102]"
58,58,anthonyandcleopatra,"CLEOPATRA: To th� monument! Mardian, go tell him I have slain myself. Say that the last I spoke was �Antony�, And word it, prithee, piteously. Hence, Mardian, And bring me how he takes my death.�To th� monument!",romantic_reunion,"[101, 22003, 1024, 2000, 16215, 6104, 999, 9388, 11692, 1010, 2175, 2425, 2032, 1045, 2031, 19668, 2870, 1012, 2360, 2008, 1996, 2197, 1045, 3764, 2001, 16262, 1010, 1998, 2773, 2009, 1010, 26927, 10760, 2063, 1010, 6770, 14769, 2135, 1012, 6516, 1010, 9388, 11692, 1010, 1998, 3288, 2033, 2129, 2002, 3138, 2026, 2331, 1012, 2000, 16215, 6104, 999, 102]"
59,59,anthonyandcleopatra,"ANTONY: My good knave Eros, now thy captain is Even such a body. Here I am Antony, Yet cannot hold this visible shape, my knave. I made these wars for Egypt, and the Queen, Whose heart I thought I had, for she had mine, Which, whilst it was mine, had annexed unto�t A million more, now lost�she, Eros, has Packed cards with Caesar, and false-played my glory Unto an enemy�s triumph. Nay, weep not, gentle Eros. There is left us Ourselves to end ourselves.",romantic_reunion,"[101, 16262, 1024, 2026, 2204, 14161, 10696, 9413, 2891, 1010, 2085, 15177, 2952, 2003, 2130, 2107, 1037, 2303, 1012, 2182, 1045, 2572, 16262, 1010, 2664, 3685, 2907, 2023, 5710, 4338, 1010, 2026, 14161, 10696, 1012, 1045, 2081, 2122, 5233, 2005, 5279, 1010, 1998, 1996, 3035, 1010, 3005, 2540, 1045, 2245, 1045, 2018, 1010, 2005, 2016, 2018, 3067, 1010, 2029, 1010, 5819, 2009, 2001, 3067, 1010, 2018, 13291, 19662, 2102, 1037, 2454, 2062, 1010, 2085, 2439, 4095, 2063, 1010, 9413, 2891, 1010, 2038, 8966, 5329, 2007, 11604, 1010, 1998, 6270, 1011, 2209, 2026, 8294, 19662, 2019, 4099, 2015, 10911, 1012, 29349, 1010, 27874, 2025, 1010, 7132, 9413, 2891, 1012, 2045, 2003, 2187, 2149, 9731, 2000, 2203, 9731, 1012, 102]"
60,60,anthonyandcleopatra,"MARDIAN: Death of one person can be paid but once, And that she has discharged. What thou wouldst do Is done unto thy hand. The last she spake Was �Antony! Most noble Antony!� Then in the midst a tearing groan did break The name of Antony; it was divided Between her heart and lips. She rendered life, Thy name so buried in her.",romantic_reunion,"[101, 9388, 11692, 1024, 2331, 1997, 2028, 2711, 2064, 2022, 3825, 2021, 2320, 1010, 1998, 2008, 2016, 2038, 14374, 1012, 2054, 15223, 2052, 3367, 2079, 2003, 2589, 19662, 15177, 2192, 1012, 1996, 2197, 2016, 12403, 3489, 2001, 16262, 999, 2087, 7015, 16262, 999, 2059, 1999, 1996, 12930, 1037, 13311, 13001, 2106, 3338, 1996, 2171, 1997, 16262, 1025, 2009, 2001, 4055, 2090, 2014, 2540, 1998, 2970, 1012, 2016, 10155, 2166, 1010, 15177, 2171, 2061, 3950, 1999, 2014, 1012, 102]"
61,61,anthonyandcleopatra,"ANTONY: Come, then, for with a wound I must be cured. Draw that thy honest sword, which thou hast worn Most useful for thy country.",noble_agented,"[101, 16262, 1024, 2272, 1010, 2059, 1010, 2005, 2007, 1037, 6357, 1045, 2442, 2022, 21391, 1012, 4009, 2008, 15177, 7481, 4690, 1010, 2029, 15223, 2038, 2102, 6247, 2087, 6179, 2005, 15177, 2406, 1012, 102]"
62,62,anthonyandcleopatra,"ANTONY: When I did make thee free, swor�st thou not then To do this when I bade thee? Do it at once, Or thy precedent services are all But accidents unpurposed. Draw, and come. ",noble_agented,"[101, 16262, 1024, 2043, 1045, 2106, 2191, 14992, 2489, 1010, 25430, 5668, 2102, 15223, 2025, 2059, 2000, 2079, 2023, 2043, 1045, 2919, 2063, 14992, 1029, 2079, 2009, 2012, 2320, 1010, 2030, 15177, 20056, 2578, 2024, 2035, 2021, 13436, 4895, 5311, 19155, 1012, 4009, 1010, 1998, 2272, 1012, 102]"
