,ind,title,text,label,tok_nums
97,97,drjekyllandmrhyde,"Will Hyde die upon the scaffold? or will he find courage to release himself at the last moment? God knows; I am careless; this is my true hour of death, and what is to follow concerns another than myself. Here then, as I lay down the pen and proceed to seal up my confession, I bring the life of that unhappy Henry Jekyll to an end.",noble_agented,"[101, 2097, 11804, 3280, 2588, 1996, 8040, 10354, 10371, 1029, 2030, 2097, 2002, 2424, 8424, 2000, 2713, 2370, 2012, 1996, 2197, 2617, 1029, 2643, 4282, 1025, 1045, 2572, 23358, 1025, 2023, 2003, 2026, 2995, 3178, 1997, 2331, 1010, 1998, 2054, 2003, 2000, 3582, 5936, 2178, 2084, 2870, 1012, 2182, 2059, 1010, 2004, 1045, 3913, 2091, 1996, 7279, 1998, 10838, 2000, 7744, 2039, 2026, 12633, 1010, 1045, 3288, 1996, 2166, 1997, 2008, 12511, 2888, 15333, 4801, 3363, 2000, 2019, 2203, 1012, 102]"
98,98,ethanfrome,"�I don't know how it is you make me feel, Matt. I'd a'most rather have you dead than that!� �Oh, I wish I was, I wish I was!� she sobbed. ",romantic_reunion,"[101, 1045, 2123, 1005, 1056, 2113, 2129, 2009, 2003, 2017, 2191, 2033, 2514, 1010, 4717, 1012, 1045, 1005, 1040, 1037, 1005, 2087, 2738, 2031, 2017, 2757, 2084, 2008, 999, 2821, 1010, 1045, 4299, 1045, 2001, 1010, 1045, 4299, 1045, 2001, 999, 2016, 25960, 1012, 102]"
99,99,ethanfrome,"�What's the good of either of us going anywheres without the other one now?� he said. She remained motionless, as if she had not heard him. Then she snatched her hands from his, threw her arms about his neck, and pressed a sudden drenched cheek against his face. �Ethan! Ethan! I want you to take me down again!� �Down where?� �The coast. Right off,� she panted. �So 't we'll never come up any more.�",romantic_reunion,"[101, 2054, 1005, 1055, 1996, 2204, 1997, 2593, 1997, 2149, 2183, 5973, 2015, 2302, 1996, 2060, 2028, 2085, 1029, 2002, 2056, 1012, 2016, 2815, 19917, 1010, 2004, 2065, 2016, 2018, 2025, 2657, 2032, 1012, 2059, 2016, 14177, 2014, 2398, 2013, 2010, 1010, 4711, 2014, 2608, 2055, 2010, 3300, 1010, 1998, 4508, 1037, 5573, 25265, 5048, 2114, 2010, 2227, 1012, 6066, 999, 6066, 999, 1045, 2215, 2017, 2000, 2202, 2033, 2091, 2153, 999, 2091, 2073, 1029, 1996, 3023, 1012, 2157, 2125, 1010, 2016, 28149, 1012, 2061, 1005, 1056, 2057, 1005, 2222, 2196, 2272, 2039, 2151, 2062, 1012, 102]"
100,100,ethanfrome,"She put her lips close against his ear to say: �Right into the big elm. You said you could. So 't we'd never have to leave each other any more.� �Why, what are you talking of? You're crazy!� �I'm not crazy; but I will be if I leave you.�",romantic_reunion,"[101, 2016, 2404, 2014, 2970, 2485, 2114, 2010, 4540, 2000, 2360, 1024, 2157, 2046, 1996, 2502, 17709, 1012, 2017, 2056, 2017, 2071, 1012, 2061, 1005, 1056, 2057, 1005, 1040, 2196, 2031, 2000, 2681, 2169, 2060, 2151, 2062, 1012, 2339, 1010, 2054, 2024, 2017, 3331, 1997, 1029, 2017, 1005, 2128, 4689, 999, 1045, 1005, 1049, 2025, 4689, 1025, 2021, 1045, 2097, 2022, 2065, 1045, 2681, 2017, 1012, 102]"
101,101,ethanfrome,"�Ethan, where'll I go if I leave you? I don't know how to get along alone. You said so yourself just now. Nobody but you was ever good to me. And there'll be that strange girl in the house... and she'll sleep in my bed, where I used to lay nights and listen to hear you come up the stairs...�",romantic_reunion,"[101, 6066, 1010, 2073, 1005, 2222, 1045, 2175, 2065, 1045, 2681, 2017, 1029, 1045, 2123, 1005, 1056, 2113, 2129, 2000, 2131, 2247, 2894, 1012, 2017, 2056, 2061, 4426, 2074, 2085, 1012, 6343, 2021, 2017, 2001, 2412, 2204, 2000, 2033, 1012, 1998, 2045, 1005, 2222, 2022, 2008, 4326, 2611, 1999, 1996, 2160, 1012, 1012, 1012, 1998, 2016, 1005, 2222, 3637, 1999, 2026, 2793, 1010, 2073, 1045, 2109, 2000, 3913, 6385, 1998, 4952, 2000, 2963, 2017, 2272, 2039, 1996, 5108, 1012, 1012, 1012, 102]"
102,102,ethanfrome,"
Here came the hated vision of the house he was going back to--of the stairs he would have to go up every night, of the woman who would wait for him there. And the sweetness of Mattie's avowal, the wild wonder of knowing at last that all that had happened to him had happened to her too, made the other vision more abhorrent, the other life more intolerable to return to...",romantic_reunion,"[101, 2182, 2234, 1996, 6283, 4432, 1997, 1996, 2160, 2002, 2001, 2183, 2067, 2000, 1011, 1011, 1997, 1996, 5108, 2002, 2052, 2031, 2000, 2175, 2039, 2296, 2305, 1010, 1997, 1996, 2450, 2040, 2052, 3524, 2005, 2032, 2045, 1012, 1998, 1996, 23210, 1997, 4717, 2666, 1005, 1055, 20704, 21293, 2140, 1010, 1996, 3748, 4687, 1997, 4209, 2012, 2197, 2008, 2035, 2008, 2018, 3047, 2000, 2032, 2018, 3047, 2000, 2014, 2205, 1010, 2081, 1996, 2060, 4432, 2062, 11113, 16368, 22787, 1010, 1996, 2060, 2166, 2062, 2046, 3917, 3085, 2000, 2709, 2000, 1012, 1012, 1012, 102]"
103,103,faust,"This life of earth, whatever my attire, Would pain me in its wonted fashion. Too old am I to play with passion; Too young, to be without desire. What from the world have I to gain?",hopeless_empty_agony,"[101, 2023, 2166, 1997, 3011, 1010, 3649, 2026, 20426, 1010, 2052, 3255, 2033, 1999, 2049, 2180, 3064, 4827, 1012, 2205, 2214, 2572, 1045, 2000, 2377, 2007, 6896, 1025, 2205, 2402, 1010, 2000, 2022, 2302, 4792, 1012, 2054, 2013, 1996, 2088, 2031, 1045, 2000, 5114, 1029, 102]"
104,104,faust,"Thou shalt abstain--renounce--refrain! Such is the everlasting song That in the ears of all men rings,-- That unrelieved, our whole life long, Each hour, in passing, hoarsely sings. In very terror I at morn awake, Upon the verge of bitter weeping, To see the day of disappointment break,",hopeless_empty_agony,"[101, 15223, 21146, 7096, 14689, 18249, 1011, 1011, 17738, 17457, 1011, 1011, 20703, 999, 2107, 2003, 1996, 2412, 8523, 3436, 2299, 2008, 1999, 1996, 5551, 1997, 2035, 2273, 7635, 1010, 1011, 1011, 2008, 4895, 16570, 2666, 7178, 1010, 2256, 2878, 2166, 2146, 1010, 2169, 3178, 1010, 1999, 4458, 1010, 21221, 2135, 10955, 1012, 1999, 2200, 7404, 1045, 2012, 22822, 2078, 8300, 1010, 2588, 1996, 16079, 1997, 8618, 19750, 1010, 2000, 2156, 1996, 2154, 1997, 10520, 3338, 1010, 102]"
105,105,faust,"
To no one hope of mine--not one--its promise keeping:-- That even each joy's presentiment With wilful cavil would diminish, With grinning masks of life prevent My mind its fairest work to finish!",hopeless_empty_agony,"[101, 2000, 2053, 2028, 3246, 1997, 3067, 1011, 1011, 2025, 2028, 1011, 1011, 2049, 4872, 4363, 1024, 1011, 1011, 2008, 2130, 2169, 6569, 1005, 1055, 2556, 14428, 3372, 2007, 19863, 3993, 6187, 14762, 2052, 11737, 5498, 4095, 1010, 2007, 11478, 15806, 1997, 2166, 4652, 2026, 2568, 2049, 4189, 4355, 2147, 2000, 3926, 999, 102]"
106,106,faust,"
The God that in my breast is owned Can deeply stir the inner sources; The God, above my powers enthroned, He cannot change external forces. So, by the burden of my days oppressed, Death is desired, and Life a thing unblest!",hopeless_empty_agony,"[101, 1996, 2643, 2008, 1999, 2026, 7388, 2003, 3079, 2064, 6171, 16130, 1996, 5110, 4216, 1025, 1996, 2643, 1010, 2682, 2026, 4204, 4372, 2705, 20793, 2094, 1010, 2002, 3685, 2689, 6327, 2749, 1012, 2061, 1010, 2011, 1996, 10859, 1997, 2026, 2420, 6728, 19811, 1010, 2331, 2003, 9059, 1010, 1998, 2166, 1037, 2518, 4895, 13510, 2102, 999, 102]"
107,107,faust,"Alas, that heart so true! My husband dead! Let me die, too!",romantic_reunion,"[101, 21862, 2015, 1010, 2008, 2540, 2061, 2995, 999, 2026, 3129, 2757, 999, 2292, 2033, 3280, 1010, 2205, 999, 102]"
108,108,faust,"Ah, dearest dame, let not your courage fail!",cowardice_foolish_unpleasant,"[101, 6289, 1010, 6203, 4355, 8214, 1010, 2292, 2025, 2115, 8424, 8246, 999, 102]"
109,109,faust,"O full and splendid Moon, whom I Have, from this desk, seen climb the sky So many a midnight,--would thy glow For the last time beheld my woe! Ever thine eye, most mournful friend, O'er books and papers saw me bend; But would that I, on mountains grand, Amid thy blessed light could stand, With spirits through mountain-caverns hover, Float in thy twilight the meadows over, And, freed from the fumes of lore that swathe me, To health in thy dewy fountains bathe me!",romantic_reunion,"[101, 1051, 2440, 1998, 21459, 4231, 1010, 3183, 1045, 2031, 1010, 2013, 2023, 4624, 1010, 2464, 7105, 1996, 3712, 2061, 2116, 1037, 7090, 1010, 1011, 1011, 2052, 15177, 8652, 2005, 1996, 2197, 2051, 2022, 24850, 2026, 24185, 2063, 999, 2412, 4857, 2063, 3239, 1010, 2087, 9587, 14287, 3993, 2767, 1010, 1051, 1005, 9413, 2808, 1998, 4981, 2387, 2033, 8815, 1025, 2021, 2052, 2008, 1045, 1010, 2006, 4020, 2882, 1010, 13463, 15177, 10190, 2422, 2071, 3233, 1010, 2007, 8633, 2083, 3137, 1011, 16679, 2015, 25215, 2099, 1010, 14257, 1999, 15177, 13132, 1996, 13524, 2058, 1010, 1998, 1010, 10650, 2013, 1996, 11865, 7834, 1997, 19544, 2008, 25414, 5369, 2033, 1010, 2000, 2740, 1999, 15177, 24903, 2100, 23497, 7198, 2063, 2033, 999, 102]"
110,110,faust,"Yet now I curse whate'er entices And snares the soul with visions vain; With dazzling cheats and dear devices Confines it in this cave of pain! Cursed be, at once, the high ambition Wherewith the mind itself deludes! Cursed be the glare of apparition That on the finer sense intrudes! Cursed be the lying dream's impression Of name, and fame, and laurelled brow! Cursed, all that flatters as possession, As wife and child, as knave and plow! Cursed Mammon be, when he with treasures To restless action spurs our fate! Cursed when, for soft, indulgent leisures, He lays for us the pillows straight! Cursed be the vine's transcendent nectar,-- The highest favor Love lets fall! Cursed, also, Hope!--cursed Faith, the spectre! And cursed be Patience most of all!",senseless_meaning_making,"[101, 2664, 2085, 1045, 8364, 2054, 2063, 1005, 9413, 4372, 4588, 2229, 1998, 1055, 26148, 2015, 1996, 3969, 2007, 12018, 15784, 1025, 2007, 28190, 21910, 2015, 1998, 6203, 5733, 25722, 2009, 1999, 2023, 5430, 1997, 3255, 999, 10678, 2022, 1010, 2012, 2320, 1010, 1996, 2152, 16290, 2073, 24415, 1996, 2568, 2993, 3972, 22087, 999, 10678, 2022, 1996, 10982, 1997, 10439, 8486, 3508, 2008, 2006, 1996, 26954, 3168, 20014, 28121, 2229, 999, 10678, 2022, 1996, 4688, 3959, 1005, 1055, 8605, 1997, 2171, 1010, 1998, 4476, 1010, 1998, 11893, 3709, 8306, 999, 10678, 1010, 2035, 2008, 4257, 7747, 2004, 6664, 1010, 2004, 2564, 1998, 2775, 1010, 2004, 14161, 10696, 1998, 20228, 5004, 999, 10678, 5003, 24521, 2022, 1010, 2043, 2002, 2007, 17605, 2000, 15035, 2895, 18205, 2256, 6580, 999, 10678, 2043, 1010, 2005, 3730, 1010, 27427, 5313, 11461, 12257, 2015, 1010, 2002, 19764, 2005, 2149, 1996, 17860, 3442, 999, 10678, 2022, 1996, 15351, 1005, 1055, 9099, 23865, 4765, 24816, 1010, 1011, 1011, 1996, 3284, 5684, 2293, 11082, 2991, 999, 10678, 1010, 2036, 1010, 3246, 999, 1011, 1011, 10678, 4752, 1010, 1996, 28699, 7913, 999, 1998, 10678, 2022, 11752, 2087, 1997, 2035, 999, 102]"
111,111,faustus,"I think my master means to die shortly, For he hath given to me all his goods And yet, methinks, if that death were near, He would not banquet, and carouse, and swill Amongst the students, as even now he doth,",hopeless_empty_agony,"[101, 1045, 2228, 2026, 3040, 2965, 2000, 3280, 3859, 1010, 2005, 2002, 6045, 2232, 2445, 2000, 2033, 2035, 2010, 5350, 1998, 2664, 1010, 2777, 10606, 5705, 1010, 2065, 2008, 2331, 2020, 2379, 1010, 2002, 2052, 2025, 19032, 1010, 1998, 2482, 15441, 1010, 1998, 25430, 8591, 5921, 1996, 2493, 1010, 2004, 2130, 2085, 2002, 11089, 2232, 1010, 102]"
112,112,faustus,"FAUSTUS: Where art thou, Faustus? wretch, what hast thou done? Damn'd art thou, Faustus, damn'd; despair and die! Hell calls for right, and with a roaring voice Says, ""Faustus, come; thine hour is almost come;"" And Faustus now will come to do thee right. [MEPHISTOPHILIS gives him a dagger.]",guilt_penance_self_loathing,"[101, 24021, 2271, 1024, 2073, 2396, 15223, 1010, 24021, 2271, 1029, 23277, 3388, 2818, 1010, 2054, 2038, 2102, 15223, 2589, 1029, 4365, 1005, 1040, 2396, 15223, 1010, 24021, 2271, 1010, 4365, 1005, 1040, 1025, 13905, 1998, 3280, 999, 3109, 4455, 2005, 2157, 1010, 1998, 2007, 1037, 17197, 2376, 2758, 1010, 1000, 24021, 2271, 1010, 2272, 1025, 4857, 2063, 3178, 2003, 2471, 2272, 1025, 1000, 1998, 24021, 2271, 2085, 2097, 2272, 2000, 2079, 14992, 2157, 1012, 1031, 2033, 21850, 16033, 21850, 6856, 3957, 2032, 1037, 10794, 1012, 1033, 102]"
113,113,faustus,"all beasts are happy, For, when they die, Their souls are soon dissolv'd in elements; But mine must live still to be plagu'd in hell. Curs'd be the parents that engender'd me! No, Faustus, curse thyself, curse Lucifer That hath depriv'd thee of the joys of heaven. [The clock strikes twelve.] O, it strikes, it strikes!  Now, body, turn to air, Or Lucifer will bear thee quick to hell! [Thunder and lightning.] O soul, be chang'd into little water-drops, And fall into the ocean, ne'er be found!",hopeless_empty_agony,"[101, 2035, 15109, 2024, 3407, 1010, 2005, 1010, 2043, 2027, 3280, 1010, 2037, 9293, 2024, 2574, 4487, 24137, 2140, 2615, 1005, 1040, 1999, 3787, 1025, 2021, 3067, 2442, 2444, 2145, 2000, 2022, 20228, 8490, 2226, 1005, 1040, 1999, 3109, 1012, 12731, 2869, 1005, 1040, 2022, 1996, 3008, 2008, 25540, 10497, 2121, 1005, 1040, 2033, 999, 2053, 1010, 24021, 2271, 1010, 8364, 15177, 11246, 2546, 1010, 8364, 24184, 2008, 6045, 2232, 2139, 18098, 12848, 1005, 1040, 14992, 1997, 1996, 6569, 2015, 1997, 6014, 1012, 1031, 1996, 5119, 9326, 4376, 1012, 1033, 1051, 1010, 2009, 9326, 1010, 2009, 9326, 999, 2085, 1010, 2303, 1010, 2735, 2000, 2250, 1010, 2030, 24184, 2097, 4562, 14992, 4248, 2000, 3109, 999, 1031, 8505, 1998, 7407, 1012, 1033, 1051, 3969, 1010, 2022, 11132, 1005, 1040, 2046, 2210, 2300, 1011, 9010, 1010, 1998, 2991, 2046, 1996, 4153, 1010, 11265, 1005, 9413, 2022, 2179, 999, 102]"
114,114,frankenstein,"But I thought Werter himself a more divine being than I had ever beheld or imagined; his character contained no pretension, but it sank deep. The disquisitions upon death and suicide were calculated to fill me with wonder. I did not pretend to enter into the merits of the case, yet I inclined towards the opinions of the hero, whose extinction I wept, without precisely understanding it.",romantic_reunion,"[101, 2021, 1045, 2245, 2057, 19418, 2370, 1037, 2062, 7746, 2108, 2084, 1045, 2018, 2412, 2022, 24850, 2030, 8078, 1025, 2010, 2839, 4838, 2053, 3653, 29048, 1010, 2021, 2009, 7569, 2784, 1012, 1996, 4487, 2015, 15549, 28032, 8496, 2588, 2331, 1998, 5920, 2020, 10174, 2000, 6039, 2033, 2007, 4687, 1012, 1045, 2106, 2025, 9811, 2000, 4607, 2046, 1996, 22617, 1997, 1996, 2553, 1010, 2664, 1045, 13050, 2875, 1996, 10740, 1997, 1996, 5394, 1010, 3005, 14446, 1045, 24966, 1010, 2302, 10785, 4824, 2009, 1012, 102]"
115,115,frankenstein,"Why did I not die? More miserable than man ever was before, why did I not sink into forgetfulness and rest? Death snatches away many blooming children, the only hopes of their doting parents; how many brides and youthful lovers have been one day in the bloom of health and hope, and the next a prey for worms and the decay of the tomb! Of what materials was I made that I could thus resist so many shocks, which, like the turning of the wheel, continually renewed the torture?",hopeless_empty_agony,"[101, 2339, 2106, 1045, 2025, 3280, 1029, 2062, 13736, 2084, 2158, 2412, 2001, 2077, 1010, 2339, 2106, 1045, 2025, 7752, 2046, 5293, 20938, 1998, 2717, 1029, 2331, 23365, 2229, 2185, 2116, 13426, 2075, 2336, 1010, 1996, 2069, 8069, 1997, 2037, 11089, 2075, 3008, 1025, 2129, 2116, 8959, 2015, 1998, 22446, 10205, 2031, 2042, 2028, 2154, 1999, 1996, 13426, 1997, 2740, 1998, 3246, 1010, 1998, 1996, 2279, 1037, 8336, 2005, 16253, 1998, 1996, 13121, 1997, 1996, 8136, 999, 1997, 2054, 4475, 2001, 1045, 2081, 2008, 1045, 2071, 2947, 9507, 2061, 2116, 28215, 1010, 2029, 1010, 2066, 1996, 3810, 1997, 1996, 5217, 1010, 14678, 9100, 1996, 8639, 1029, 102]"
116,116,frankenstein,"

But I was doomed to live and in two months found myself as awaking from a dream, in a prison, stretched on a wretched bed, surrounded by gaolers, turnkeys, bolts, and all the miserable apparatus of a dungeon.",hopeless_empty_agony,"[101, 2021, 1045, 2001, 20076, 2000, 2444, 1998, 1999, 2048, 2706, 2179, 2870, 2004, 22091, 15495, 2013, 1037, 3959, 1010, 1999, 1037, 3827, 1010, 7121, 2006, 1037, 23277, 29574, 2793, 1010, 5129, 2011, 17377, 12910, 1010, 2735, 14839, 2015, 1010, 19947, 1010, 1998, 2035, 1996, 13736, 14709, 1997, 1037, 16633, 1012, 102]"
117,117,frankenstein,I was overcome by gloom and misery and often reflected I had better seek death than desire to remain in a world which to me was replete with wretchedness.,hopeless_empty_agony,"[101, 1045, 2001, 9462, 2011, 24067, 1998, 14624, 1998, 2411, 7686, 1045, 2018, 2488, 6148, 2331, 2084, 4792, 2000, 3961, 1999, 1037, 2088, 2029, 2000, 2033, 2001, 16360, 25890, 2007, 23277, 29574, 2791, 1012, 102]"
118,118,frankenstein,"At one time I considered whether I should not declare myself guilty and suffer the penalty of the law, less innocent than poor Justine had been.",guilt_penance_self_loathing,"[101, 2012, 2028, 2051, 1045, 2641, 3251, 1045, 2323, 2025, 13520, 2870, 5905, 1998, 9015, 1996, 6531, 1997, 1996, 2375, 1010, 2625, 7036, 2084, 3532, 26377, 2018, 2042, 1012, 102]"
119,119,frankenstein,"""on the whole earth there is no comfort which I am capable of receiving.�",hopeless_empty_agony,"[101, 1000, 2006, 1996, 2878, 3011, 2045, 2003, 2053, 7216, 2029, 1045, 2572, 5214, 1997, 4909, 1012, 102]"
120,120,frankenstein,"
""I am, by a course of strange events, become the most miserable of mortals. Persecuted and tortured as I am and have been, can death be any evil to me?�",hopeless_empty_agony,"[101, 1000, 1045, 2572, 1010, 2011, 1037, 2607, 1997, 4326, 2824, 1010, 2468, 1996, 2087, 13736, 1997, 23844, 1012, 27666, 1998, 12364, 2004, 1045, 2572, 1998, 2031, 2042, 1010, 2064, 2331, 2022, 2151, 4763, 2000, 2033, 1029, 102]"
121,121,frankenstein,"More than once the agitation into which these reflections threw me made my friends dread a dangerous relapse. Alas! Why did they preserve so miserable and detested a life? It was surely that I might fulfil my destiny, which is now drawing to a close. Soon, oh, very soon, will death extinguish these throbbings and relieve me from the mighty weight of anguish that bears me to the dust; and, in executing the award of justice, I shall also sink to rest. ",guilt_penance_self_loathing,"[101, 2062, 2084, 2320, 1996, 22356, 2046, 2029, 2122, 16055, 4711, 2033, 2081, 2026, 2814, 14436, 1037, 4795, 2128, 2721, 29251, 1012, 21862, 2015, 999, 2339, 2106, 2027, 7969, 2061, 13736, 1998, 20010, 17944, 1037, 2166, 1029, 2009, 2001, 7543, 2008, 1045, 2453, 11865, 10270, 4014, 2026, 10461, 1010, 2029, 2003, 2085, 5059, 2000, 1037, 2485, 1012, 2574, 1010, 2821, 1010, 2200, 2574, 1010, 2097, 2331, 4654, 3436, 27020, 2232, 2122, 17061, 2015, 1998, 15804, 2033, 2013, 1996, 10478, 3635, 1997, 21782, 2008, 6468, 2033, 2000, 1996, 6497, 1025, 1998, 1010, 1999, 23448, 1996, 2400, 1997, 3425, 1010, 1045, 4618, 2036, 7752, 2000, 2717, 1012, 102]"
122,122,frankenstein,"Then the appearance of death was distant, although the wish was ever present to my thoughts; and I often sat for hours motionless and speechless, wishing for some mighty revolution that might bury me and my destroyer in its ruins.",hopeless_empty_agony,"[101, 2059, 1996, 3311, 1997, 2331, 2001, 6802, 1010, 2348, 1996, 4299, 2001, 2412, 2556, 2000, 2026, 4301, 1025, 1998, 1045, 2411, 2938, 2005, 2847, 19917, 1998, 25146, 1010, 10261, 2005, 2070, 10478, 4329, 2008, 2453, 11010, 2033, 1998, 2026, 9799, 1999, 2049, 8435, 1012, 102]"
123,123,frankenstein,"On that night he had determined to consummate his crimes by my death. Well, be it so; a deadly struggle would then assuredly take place, in which if he were victorious I should be at peace and his power over me be at an end.",hopeless_empty_agony,"[101, 2006, 2008, 2305, 2002, 2018, 4340, 2000, 9530, 17421, 8585, 2010, 6997, 2011, 2026, 2331, 1012, 2092, 1010, 2022, 2009, 2061, 1025, 1037, 9252, 5998, 2052, 2059, 8916, 2135, 2202, 2173, 1010, 1999, 2029, 2065, 2002, 2020, 13846, 1045, 2323, 2022, 2012, 3521, 1998, 2010, 2373, 2058, 2033, 2022, 2012, 2019, 2203, 1012, 102]"
124,124,frankenstein,And now my wanderings began which are to cease but with life. I have traversed a vast portion of the earth and have endured all the hardships which travellers in deserts and barbarous countries are wont to meet. How I have lived I hardly know; many times have I stretched my failing limbs upon the sandy plain and prayed for death.,hopeless_empty_agony,"[101, 1998, 2085, 2026, 13071, 2015, 2211, 2029, 2024, 2000, 13236, 2021, 2007, 2166, 1012, 1045, 2031, 27797, 1037, 6565, 4664, 1997, 1996, 3011, 1998, 2031, 16753, 2035, 1996, 26479, 2015, 2029, 19284, 1999, 28858, 1998, 3347, 8237, 3560, 3032, 2024, 2180, 2102, 2000, 3113, 1012, 2129, 1045, 2031, 2973, 1045, 6684, 2113, 1025, 2116, 2335, 2031, 1045, 7121, 2026, 7989, 10726, 2588, 1996, 7525, 5810, 1998, 14283, 2005, 2331, 1012, 102]"
125,125,frankenstein,"If he were vanquished, I should be a free man. Alas! What freedom? Such as the peasant enjoys when his family have been massacred before his eyes, his cottage burnt, his lands laid waste, and he is turned adrift, homeless, penniless, and alone, but free. Such would be my liberty except that in my Elizabeth I possessed a treasure, alas, balanced by those horrors of remorse and guilt which would pursue me until death.",guilt_penance_self_loathing,"[101, 2065, 2002, 2020, 3158, 15549, 14740, 1010, 1045, 2323, 2022, 1037, 2489, 2158, 1012, 21862, 2015, 999, 2054, 4071, 1029, 2107, 2004, 1996, 14539, 15646, 2043, 2010, 2155, 2031, 2042, 9288, 2094, 2077, 2010, 2159, 1010, 2010, 9151, 11060, 1010, 2010, 4915, 4201, 5949, 1010, 1998, 2002, 2003, 2357, 4748, 16338, 1010, 11573, 1010, 9502, 9463, 4757, 1010, 1998, 2894, 1010, 2021, 2489, 1012, 2107, 2052, 2022, 2026, 7044, 3272, 2008, 1999, 2026, 3870, 1045, 8679, 1037, 8813, 1010, 21862, 2015, 1010, 12042, 2011, 2216, 22812, 1997, 23124, 1998, 8056, 2029, 2052, 7323, 2033, 2127, 2331, 1012, 102]"
126,126,frankenstein,"My thoughts and every feeling of my soul have been drunk up by the interest for my guest which this tale and his own elevated and gentle manners have created. I wish to soothe him, yet can I counsel one so infinitely miserable, so destitute of every hope of consolation, to live? Oh, no! The only joy that he can now know will be when he composes his shattered spirit to peace and death. ",hopeless_empty_agony,"[101, 2026, 4301, 1998, 2296, 3110, 1997, 2026, 3969, 2031, 2042, 7144, 2039, 2011, 1996, 3037, 2005, 2026, 4113, 2029, 2023, 6925, 1998, 2010, 2219, 8319, 1998, 7132, 14632, 2031, 2580, 1012, 1045, 4299, 2000, 28384, 2032, 1010, 2664, 2064, 1045, 9517, 2028, 2061, 25773, 13736, 1010, 2061, 4078, 3775, 24518, 1997, 2296, 3246, 1997, 24831, 1010, 2000, 2444, 1029, 2821, 1010, 2053, 999, 1996, 2069, 6569, 2008, 2002, 2064, 2085, 2113, 2097, 2022, 2043, 2002, 17202, 2015, 2010, 10909, 4382, 2000, 3521, 1998, 2331, 1012, 102]"
127,127,frankenstein,"Fear not that I shall be the instrument of future mischief. My work is nearly complete. Neither yours nor any man�s death is needed to consummate the series of my being and accomplish that which must be done, but it requires my own. Do not think that I shall be slow to perform this sacrifice. I shall quit your vessel on the ice raft which brought me thither and shall seek the most northern extremity of the globe; I shall collect my funeral pile and consume to ashes this miserable frame, that its remains may afford no light to any curious and unhallowed wretch who would create such another as I have been. ",guilt_penance_self_loathing,"[101, 3571, 2025, 2008, 1045, 4618, 2022, 1996, 6602, 1997, 2925, 25166, 1012, 2026, 2147, 2003, 3053, 3143, 1012, 4445, 6737, 4496, 2151, 16042, 2331, 2003, 2734, 2000, 9530, 17421, 8585, 1996, 2186, 1997, 2026, 2108, 1998, 14570, 2008, 2029, 2442, 2022, 2589, 1010, 2021, 2009, 5942, 2026, 2219, 1012, 2079, 2025, 2228, 2008, 1045, 4618, 2022, 4030, 2000, 4685, 2023, 8688, 1012, 1045, 4618, 8046, 2115, 6258, 2006, 1996, 3256, 21298, 2029, 2716, 2033, 16215, 8939, 2121, 1998, 4618, 6148, 1996, 2087, 2642, 4654, 7913, 16383, 1997, 1996, 7595, 1025, 1045, 4618, 8145, 2026, 6715, 8632, 1998, 16678, 2000, 11289, 2023, 13736, 4853, 1010, 2008, 2049, 3464, 2089, 8984, 2053, 2422, 2000, 2151, 8025, 1998, 4895, 9892, 15096, 23277, 3388, 2818, 2040, 2052, 3443, 2107, 2178, 2004, 1045, 2031, 2042, 1012, 102]"
128,128,frankenstein,"I shall die. I shall no longer feel the agonies which now consume me or be the prey of feelings unsatisfied, yet unquenched.",hopeless_empty_agony,"[101, 1045, 4618, 3280, 1012, 1045, 4618, 2053, 2936, 2514, 1996, 3283, 15580, 2029, 2085, 16678, 2033, 2030, 2022, 1996, 8336, 1997, 5346, 4895, 16846, 2483, 10451, 1010, 2664, 4895, 4226, 19282, 1012, 102]"
129,129,frankenstein,"I shall no longer see the sun or stars or feel the winds play on my cheeks. Light, feeling, and sense will pass away; and in this condition must I find my happiness.",hopeless_empty_agony,"[101, 1045, 4618, 2053, 2936, 2156, 1996, 3103, 2030, 3340, 2030, 2514, 1996, 7266, 2377, 2006, 2026, 6029, 1012, 2422, 1010, 3110, 1010, 1998, 3168, 2097, 3413, 2185, 1025, 1998, 1999, 2023, 4650, 2442, 1045, 2424, 2026, 8404, 1012, 102]"
